{
  "receiptId": "RCPT-FF-P0-001-0001",
  "taskId": "FF-P0-001",
  "grantId": "GRANT-FF-P0-001-0001",
  "status": "COMPLETED",
  "startedAt": "2026-08-13T03:09:10Z",
  "finishedAt": "2026-08-13T03:56:00Z",
  "changedPaths": [
    ".env.example",
    ".gitattributes",
    ".gitignore",
    ".github/workflows/ci.yml",
    ".mvn/wrapper/maven-wrapper.properties",
    "README.md",
    "docker-compose.local.yml",
    "docs/00-governance/project-status.md",
    "docs/05-engineering/generated/task-capsule-index.md",
    "docs/05-engineering/task-capsule-catalog.md",
    "docs/09-delivery/evidence-index.md",
    "evidence/p0/agent-receipt.json",
    "evidence/p0/flyway-migrate.txt",
    "evidence/p0/health.txt",
    "evidence/p0/mvn-verify.txt",
    "evidence/p0/readiness-db-down.txt",
    "evidence/p0/readiness-db-up.txt",
    "evidence/p0/repo-hygiene.txt",
    "frameflow-app/pom.xml",
    "frameflow-app/src/main/java/com/frameflow/FrameFlowApplication.java",
    "frameflow-app/src/main/java/com/frameflow/probe/PostgresReadinessChecker.java",
    "frameflow-app/src/main/java/com/frameflow/probe/ProbeController.java",
    "frameflow-app/src/main/java/com/frameflow/probe/ProbeResponse.java",
    "frameflow-app/src/main/java/com/frameflow/probe/ReadinessChecker.java",
    "frameflow-app/src/main/resources/application.yml",
    "frameflow-app/src/main/resources/db/migration/V1__baseline.sql",
    "frameflow-app/src/test/java/com/frameflow/FrameFlowApplicationIntegrationTest.java",
    "frameflow-app/src/test/java/com/frameflow/probe/ProbeControllerTest.java",
    "frameflow-app/src/test/resources/docker-java.properties",
    "frameflow-modules/identity/pom.xml",
    "frameflow-modules/identity/src/main/java/com/frameflow/identity/package-info.java",
    "frameflow-modules/pom.xml",
    "frameflow-shared-kernel/pom.xml",
    "frameflow-shared-kernel/src/main/java/com/frameflow/shared/package-info.java",
    "mvnw",
    "mvnw.cmd",
    "pom.xml",
    "scripts/p0/check-build.sh",
    "scripts/p0/check-flyway.sh",
    "scripts/p0/check-health.sh",
    "scripts/p0/check-readiness-db-down.sh",
    "scripts/p0/check-readiness-db-up.sh",
    "scripts/p0/check-repo-hygiene.sh",
    "scripts/p0/common.sh"
  ],
  "commandResults": [
    { "command": "sh scripts/p0/check-build.sh", "exitCode": 0, "stdoutRef": "evidence/p0/mvn-verify.txt" },
    { "command": "sh scripts/p0/check-health.sh", "exitCode": 0, "stdoutRef": "evidence/p0/health.txt" },
    { "command": "sh scripts/p0/check-readiness-db-down.sh", "exitCode": 0, "stdoutRef": "evidence/p0/readiness-db-down.txt" },
    { "command": "sh scripts/p0/check-readiness-db-up.sh", "exitCode": 0, "stdoutRef": "evidence/p0/readiness-db-up.txt" },
    { "command": "sh scripts/p0/check-flyway.sh", "exitCode": 0, "stdoutRef": "evidence/p0/flyway-migrate.txt" },
    { "command": "sh scripts/p0/check-repo-hygiene.sh", "exitCode": 0, "stdoutRef": "evidence/p0/repo-hygiene.txt" }
  ],
  "testResults": [
    { "testId": "TEST-FF-P0-001-01", "result": "PASS", "reportRef": "evidence/p0/mvn-verify.txt" },
    { "testId": "TEST-FF-P0-001-02", "result": "PASS", "reportRef": "evidence/p0/health.txt" },
    { "testId": "TEST-FF-P0-001-03", "result": "PASS", "reportRef": "evidence/p0/readiness-db-down.txt" },
    { "testId": "TEST-FF-P0-001-04", "result": "PASS", "reportRef": "evidence/p0/readiness-db-up.txt" },
    { "testId": "TEST-FF-P0-001-05", "result": "PASS", "reportRef": "evidence/p0/flyway-migrate.txt" },
    { "testId": "TEST-FF-P0-001-06", "result": "PASS", "reportRef": "evidence/p0/repo-hygiene.txt" }
  ],
  "evidenceRefs": [
    "EV-FF-P0-001-01",
    "EV-FF-P0-001-02",
    "EV-FF-P0-001-03",
    "EV-FF-P0-001-04",
    "EV-FF-P0-001-05",
    "EV-FF-P0-001-06"
  ],
  "acceptanceResults": [
    { "acceptanceId": "AC-FF-P0-001-01", "result": "PASS", "evidenceIds": ["EV-FF-P0-001-01"] },
    { "acceptanceId": "AC-FF-P0-001-02", "result": "PASS", "evidenceIds": ["EV-FF-P0-001-02"] },
    { "acceptanceId": "AC-FF-P0-001-03", "result": "PASS", "evidenceIds": ["EV-FF-P0-001-03"] },
    { "acceptanceId": "AC-FF-P0-001-04", "result": "PASS", "evidenceIds": ["EV-FF-P0-001-04"] },
    { "acceptanceId": "AC-FF-P0-001-05", "result": "PASS", "evidenceIds": ["EV-FF-P0-001-05"] },
    { "acceptanceId": "AC-FF-P0-001-06", "result": "PASS", "evidenceIds": ["EV-FF-P0-001-06"] }
  ],
  "overBudget": false,
  "unknowns": [
    "P0 只验证本地 Docker Engine 29.6.1 与 PostgreSQL 16.14；未作生产环境或云环境声明。"
  ],
  "proposals": [
    "保持 FF-M01-001=CONTRACT_READY；进入 M01 前重新签发新的 Grant，并由用户确认继续正式业务开发。"
  ]
}
