{
  "receiptId": "RCPT-FF-M01H-001-0001",
  "taskId": "FF-M01H-001",
  "grantId": "GRANT-FF-M01H-001-0001",
  "status": "COMPLETED",
  "startedAt": "2026-08-20T01:53:11Z",
  "finishedAt": "2026-08-20T03:39:41Z",
  "changedPaths": [
    "README.md",
    "docs/00-governance/project-status.md",
    "docs/00-governance/下次继续FrameFlow开发启动指南.md",
    "docs/00-governance/正式开发前检查清单.md",
    "docs/01-product/FrameFlow-PRD.md",
    "docs/02-architecture/FrameFlow-概要设计.md",
    "docs/02-architecture/adr/ADR-012-前端技术选型.md",
    "docs/02-architecture/architecture-evolution-roadmap.md",
    "docs/02-architecture/deployment-topology.md",
    "docs/02-architecture/module-boundaries-and-dependency-rules.md",
    "docs/02-architecture/service-boundaries-and-data-ownership.md",
    "docs/03-data/FrameFlow-详细设计.md",
    "docs/03-data/identity-data-dictionary.md",
    "docs/03-data/project-data-dictionary.md",
    "docs/05-engineering/development-plan-p0-m17.md",
    "docs/05-engineering/frontend-development.md",
    "docs/05-engineering/generated/task-capsule-index.md",
    "docs/05-engineering/registries/requirements.json",
    "docs/05-engineering/registries/test-cases.json",
    "docs/05-engineering/task-capsule-catalog.md",
    "docs/05-engineering/task-capsule-spec.md",
    "docs/05-engineering/tasks/M01F/FF-M01F-001.json",
    "docs/05-engineering/tasks/M02/FF-M02-001.json",
    "docs/05-engineering/tasks/M02/FF-M02-002.json",
    "docs/05-engineering/tasks/M02/FF-M02-003.json",
    "docs/05-engineering/tasks/M02/FF-M02-004.json",
    "docs/05-engineering/tasks/M04F/FF-M04F-001.json",
    "docs/05-engineering/tasks/M08F/FF-M08F-001.json",
    "docs/06-testing/acceptance-matrix.md",
    "docs/06-testing/test-strategy.md",
    "docs/09-delivery/evidence-index.md",
    "evidence/m01/agent-receipt.json",
    "evidence/m01/auth-flows.txt",
    "evidence/m01/capability-grant.json",
    "evidence/m01/migration.txt",
    "evidence/m01/mvn-verify.txt",
    "evidence/m01/openapi-diff.txt",
    "evidence/m01h/agent-receipt.json",
    "evidence/m01h/auth-flows.txt",
    "evidence/m01h/hardening-checks.txt",
    "evidence/m01h/migration.txt",
    "evidence/m01h/mvn-verify.txt",
    "evidence/m01h/openapi-diff.txt",
    "frameflow-app/pom.xml",
    "frameflow-app/src/main/java/com/frameflow/web/OpenApiContractConfig.java",
    "frameflow-app/src/test/java/com/frameflow/architecture/ModuleArchitectureTest.java",
    "frameflow-app/src/test/java/com/frameflow/identity/ActiveUserPolicyIntegrationTest.java",
    "frameflow-app/src/test/java/com/frameflow/identity/ConcurrencyConflictTest.java",
    "frameflow-app/src/test/java/com/frameflow/identity/JwtKeyRotationTest.java",
    "frameflow-app/src/test/java/com/frameflow/identity/OpenApiNormalizerSensitivityTest.java",
    "frameflow-app/src/test/java/com/frameflow/identity/PersistenceConflictTranslationTest.java",
    "frameflow-app/src/test/java/com/frameflow/identity/support/OpenApiNormalizer.java",
    "frameflow-modules/identity/src/main/java/com/frameflow/identity/application/AccessTokenService.java",
    "frameflow-modules/identity/src/main/java/com/frameflow/identity/application/ActiveUserPolicy.java",
    "frameflow-modules/identity/src/main/java/com/frameflow/identity/application/IdempotencyService.java",
    "frameflow-modules/identity/src/main/java/com/frameflow/identity/application/RefreshTokenService.java",
    "frameflow-modules/identity/src/main/java/com/frameflow/identity/application/TeamService.java",
    "frameflow-modules/identity/src/main/java/com/frameflow/identity/application/UserService.java",
    "frameflow-modules/identity/src/main/java/com/frameflow/identity/application/model/AuthModels.java",
    "frameflow-modules/identity/src/main/java/com/frameflow/identity/application/model/TeamModels.java",
    "frameflow-modules/identity/src/main/java/com/frameflow/identity/application/port/out/IdempotencyRecordRepository.java",
    "frameflow-modules/identity/src/main/java/com/frameflow/identity/application/port/out/RefreshTokenSessionRepository.java",
    "frameflow-modules/identity/src/main/java/com/frameflow/identity/application/port/out/TeamMemberRepository.java",
    "frameflow-modules/identity/src/main/java/com/frameflow/identity/application/port/out/TeamRepository.java",
    "frameflow-modules/identity/src/main/java/com/frameflow/identity/application/port/out/UserRepository.java",
    "frameflow-modules/identity/src/main/java/com/frameflow/identity/config/JwtKeyConfig.java",
    "frameflow-modules/identity/src/main/java/com/frameflow/identity/config/JwtProperties.java",
    "frameflow-modules/identity/src/main/java/com/frameflow/identity/infrastructure/persistence/IdempotencyRecordMapper.java",
    "frameflow-modules/identity/src/main/java/com/frameflow/identity/infrastructure/persistence/IdempotencyRecordRepositoryAdapter.java",
    "frameflow-modules/identity/src/main/java/com/frameflow/identity/infrastructure/persistence/RefreshTokenSessionMapper.java",
    "frameflow-modules/identity/src/main/java/com/frameflow/identity/infrastructure/persistence/RefreshTokenSessionRepositoryAdapter.java",
    "frameflow-modules/identity/src/main/java/com/frameflow/identity/infrastructure/persistence/TeamMemberRepositoryAdapter.java",
    "frameflow-modules/identity/src/main/java/com/frameflow/identity/infrastructure/persistence/TeamRepositoryAdapter.java",
    "frameflow-modules/identity/src/main/java/com/frameflow/identity/infrastructure/persistence/UserRepositoryAdapter.java",
    "frameflow-modules/identity/src/main/java/com/frameflow/identity/security/JwtAuthenticationFilter.java",
    "frameflow-modules/identity/src/main/java/com/frameflow/identity/web/AuthController.java",
    "frameflow-modules/identity/src/main/java/com/frameflow/identity/web/TeamController.java",
    "scripts/m01/auth-flows.sh",
    "scripts/m01/check-migration.sh",
    "scripts/m01/check-openapi-diff.sh",
    "scripts/m01/common.sh",
    "scripts/m01h/check-build.sh",
    "scripts/m01h/check-hardening.sh"
  ],
  "commandResults": [
    {
      "command": "sh scripts/m01h/check-build.sh",
      "exitCode": 0,
      "stdoutRef": "evidence/m01h/mvn-verify.txt"
    },
    {
      "command": "FRAMEFLOW_M01_EVIDENCE_DIR=evidence/m01h sh scripts/m01/auth-flows.sh",
      "exitCode": 0,
      "stdoutRef": "evidence/m01h/auth-flows.txt"
    },
    {
      "command": "FRAMEFLOW_M01_EVIDENCE_DIR=evidence/m01h sh scripts/m01/check-migration.sh",
      "exitCode": 0,
      "stdoutRef": "evidence/m01h/migration.txt"
    },
    {
      "command": "FRAMEFLOW_M01_EVIDENCE_DIR=evidence/m01h sh scripts/m01/check-openapi-diff.sh",
      "exitCode": 0,
      "stdoutRef": "evidence/m01h/openapi-diff.txt"
    },
    {
      "command": "sh scripts/m01h/check-hardening.sh",
      "exitCode": 0,
      "stdoutRef": "evidence/m01h/hardening-checks.txt"
    }
  ],
  "testResults": [
    {
      "testId": "TEST-FF-M01H-001-01",
      "result": "PASS",
      "reportRef": "evidence/m01h/hardening-checks.txt"
    },
    {
      "testId": "TEST-FF-M01H-001-02",
      "result": "PASS",
      "reportRef": "evidence/m01h/hardening-checks.txt"
    },
    {
      "testId": "TEST-FF-M01H-001-03",
      "result": "PASS",
      "reportRef": "evidence/m01h/mvn-verify.txt"
    },
    {
      "testId": "TEST-FF-M01H-001-04",
      "result": "PASS",
      "reportRef": "evidence/m01h/mvn-verify.txt"
    },
    {
      "testId": "TEST-FF-M01H-001-05",
      "result": "PASS",
      "reportRef": "evidence/m01h/mvn-verify.txt"
    },
    {
      "testId": "TEST-FF-M01H-001-06",
      "result": "PASS",
      "reportRef": "evidence/m01h/openapi-diff.txt"
    },
    {
      "testId": "TEST-FF-M01H-001-07",
      "result": "PASS",
      "reportRef": "evidence/m01h/hardening-checks.txt"
    }
  ],
  "evidenceRefs": [
    "EV-FF-M01H-001-01",
    "EV-FF-M01H-001-02",
    "EV-FF-M01H-001-03",
    "EV-FF-M01H-001-04",
    "EV-FF-M01H-001-05"
  ],
  "acceptanceResults": [
    {
      "acceptanceId": "AC-FF-M01H-001-01",
      "result": "PASS",
      "evidenceIds": ["EV-FF-M01H-001-02"]
    },
    {
      "acceptanceId": "AC-FF-M01H-001-02",
      "result": "PASS",
      "evidenceIds": ["EV-FF-M01H-001-02"]
    },
    {
      "acceptanceId": "AC-FF-M01H-001-03",
      "result": "PASS",
      "evidenceIds": ["EV-FF-M01H-001-01"]
    },
    {
      "acceptanceId": "AC-FF-M01H-001-04",
      "result": "PASS",
      "evidenceIds": ["EV-FF-M01H-001-01", "EV-FF-M01H-001-03"]
    },
    {
      "acceptanceId": "AC-FF-M01H-001-05",
      "result": "PASS",
      "evidenceIds": ["EV-FF-M01H-001-01", "EV-FF-M01H-001-05"]
    },
    {
      "acceptanceId": "AC-FF-M01H-001-06",
      "result": "PASS",
      "evidenceIds": ["EV-FF-M01H-001-02"]
    }
  ],
  "overBudget": false,
  "unknowns": [
    "五条正式 Evidence 均记录 formal subject commit 4139d94e71440b565bd1424c035bd4ce5bdd0086；最终 Evidence/状态提交是其可审计后继，不替换该实现锚点。",
    "V3__table_and_column_comments.sql 是 M01-H 之前的用户改动，已按用户授权独立提交为 2aa295d915b88c7cc1c32f202d94859479f0bc3b；本 Receipt 不把该路径归因于 M01-H，但迁移 Evidence 已验证 V1/V2/V3。",
    "旧 Token 已从当前工作树 Evidence 脱敏，但 Git 历史未改写，历史 Token 是否已撤销仍未验证，需要独立安全授权。"
  ],
  "proposals": [
    "下一主线动作是完成 FF-M02-001 Contract Gate 的 UNKNOWN 决策与用户批准；在此之前不派发 M02 业务实现。",
    "另立安全任务决定是否撤销本地测试 Refresh Session、轮换本地密钥及清理远程 Git 历史；不得在本任务中默认为已处理。"
  ]
}
